{"summary":"Repaired hub route classification in `src/hub.ts`: descriptions no longer affect access type; stable proxy/downstream identifiers classify defaults; optional `invocationAction` overrides multiplexed routes and is retained as `resource.metadata.invocationAction`. Added public regressions for incidental description terms and read/write/destructive/auth-admin/control-plane invocation actions. No deployment or live-runtime claim is made.","claimedComplete":true,"validationCommands":["pnpm build","pnpm check && pnpm test","git diff --check"],"completionBoundary":"Completed only within @create-something/mcp-authz; no files outside the package were changed."}