{"summary":"Repaired route classification in `src/hub.ts`: descriptions no longer affect authorization intent; optional `invocationAction` overrides multiplexed route defaults, is retained in resource metadata, and drives write intent. Added regressions for incidental description terms, all five action intents, and authorization behavior.","claimedComplete":true,"validationCommands":["pnpm check","pnpm test"],"completionBoundary":"Source validation passed. No deployment or live-runtime validation was performed."}