{"summary":"Repaired hub route classification in `src/hub.ts`: free-form descriptions no longer influence access type; stable route identifiers are used by default, while optional `invocationAction` overrides classification for multiplexed tools and is retained in resource metadata. Added public regression coverage for incidental `state`/`trash` descriptions and all five invocation intent types. No deployment or live-runtime validation was performed.","claimedComplete":true,"validationCommands":["pnpm test (red regression loop; expected 2 failures before repair)","pnpm build && node --test test/authz.test.mjs","pnpm build && pnpm check && pnpm test && git diff --check && git diff -- src/hub.ts test/authz.test.mjs"],"completionBoundary":"Source changes and package validation are complete within @create-something/mcp-authz only; no deployment, remote, history, or live runtime state was inspected."}