{"summary":"Repaired MCP hub classification. Descriptions no longer affect access classification; optional `invocationAction` takes priority over route identifiers and is retained in request metadata. Added regression coverage for incidental prose, multiplexed actions, all intent classes, and metadata propagation.","claimedComplete":true,"validationCommands":["pnpm test","pnpm check","git diff --check"],"completionBoundary":"Validated source and package tests only. No deployment or live-runtime verification was performed."}